variable name,wb_code,title,topic,definition,year_note,n_countries,source_org
safe_water,SH.H2O.SMDW.ZS,People using safely managed drinking water services (% of population),Environment,"The percentage of people using drinking water from an improved source that is accessible on premises, available when needed and free from fecal and priority chemical contamination. Improved water sources include piped water, boreholes or tubewells, protected dug wells, protected springs, and packaged or delivered water.",Most recent value within 2018-2022. Years range 2021-2022; most common year 2022; 99.4% of values from 2022.,174,"WHO/UNICEF Joint Monitoring Programme (JMP) for Water Supply, Sanitation and Hygiene, World Health Organization (WHO), uri: washdata.org, note: Aggregate data by groups are computed based on the groupings for the World Bank fiscal year in which the data was released by the WHO/UNICEF Joint Monitoring Programme (JMP) for Water Supply, Sanitation and Hygiene., publisher: WHO/UNICEF Joint Monitoring Programme (JMP) for Water Supply, Sanitation and Hygiene (washdata.org), date accessed: 2025-09-30, date published: 2025-08-25;
UN Children's Fund (UNICEF), uri: washdata.org, note: WHO/UNICEF Joint Monitoring Programme (JMP) for Water Supply, Sanitation and Hygiene"
safe_sanit,SH.STA.SMSS.ZS,People using safely managed sanitation services (% of population),Environment,"The percentage of people using improved sanitation facilities that are not shared with other households and where excreta are safely disposed of in situ or transported and treated offsite. Improved sanitation facilities include flush/pour flush to piped sewer systems, septic tanks or pit latrines: ventilated improved pit latrines, composting toilets or pit latrines with slabs.",Most recent value within 2018-2022. Years range 2018-2022; most common year 2022; 98.8% of values from 2022.,171,"WHO/UNICEF Joint Monitoring Programme (JMP) for Water Supply, Sanitation and Hygiene, World Health Organization (WHO), uri: washdata.org, note: Aggregate data by groups are computed based on the groupings for the World Bank fiscal year in which the data was released by the WHO/UNICEF Joint Monitoring Programme (JMP) for Water Supply, Sanitation and Hygiene., publisher: WHO/UNICEF Joint Monitoring Programme (JMP) for Water Supply, Sanitation and Hygiene (washdata.org), date accessed: 2025-09-30, date published: 2025-08-25;
UN Children's Fund (UNICEF), uri: washdata.org, note: WHO/UNICEF Joint Monitoring Programme (JMP) for Water Supply, Sanitation and Hygiene"
migrant_stock,SM.POP.TOTL,"International migrant stock, total",Migration & refugees,"International migrant stock, total is the number of people at mid-year born in a country other than that in which they live. It also includes refugees.",Most recent value within 2018-2022. Years range 2020-2020; most common year 2020; 0.0% of values from 2022.,258,"International Migrant Stock, United Nations (UN), publisher: UN Population Division"
migrant_stock_pct,SM.POP.TOTL.ZS,International migrant stock (% of population),Migration & refugees,International migrant stock (% of population) is the proportion of people at mid-year born in a country other than that in which they live. It also includes refugees.,Most recent value within 2018-2022. Years range 2020-2020; most common year 2020; 0.0% of values from 2022.,259,"International Migrant Stock, United Nations (UN), publisher: UN Population Division"
net_migration,SM.POP.NETM,Net migration,Migration & refugees,"Net migration is the net total of migrants during the period, that is, the number of immigrants minus the number of emigrants, including both citizens and noncitizens.",All values from 2022.,260,"World Population Prospects, United Nations (UN), publisher: UN Population Division"
refugees_asylum,SM.POP.RHCR.EA,Refugees under the mandate of the UNHCR by country or territory of asylum,Migration & refugees,"Refugees under the mandate of the Office of the United Nations High Commissioner for Refugees (UNHCR) include individuals recognized under the 1951 Convention relating to the Status of Refugees, its 1967 Protocol, the 1969 Organization of African Unity (OAU) Convention Governing the Specific Aspects of Refugee Problems in Africa, the refugee definition contained in the 1984 Cartagena Declaration on Refugees as incorporated into national laws, those recognized in accordance with the UNHCR Statute, individuals granted complementary forms of protection, and those enjoying temporary protection. The refugee population also includes people in a refugee-like situation, which is a category that is descriptive in nature and includes groups of people who are outside their country or territory of origin and who face protection risks similar to those of refugees, but for whom refugee status has, for practical or other reasons, not been ascertained. Refugees under the mandate of the United Nations Relief and Works Agency for Palestine Refugees in the Near East (UNRWA), Palestine Refugees, are not typically included in the statistics on refugees (and people in a refugee-like situation) under the mandate of the UNHCR.",Most recent value within 2018-2022. Years range 2018-2022; most common year 2022; 98.2% of values from 2022.,221,"Refugee Population Statistics Database, UN High Commissioner for Refugees (UNHCR), uri: https://www.unhcr.org/refugee-statistics/download"
refugees_origin,SM.POP.RHCR.EO,Refugees under the mandate of the UNHCR by country or territory of origin,Migration & refugees,"Refugees under the mandate of the Office of the United Nations High Commissioner for Refugees (UNHCR) include individuals recognized under the 1951 Convention relating to the Status of Refugees, its 1967 Protocol, the 1969 Organization of African Unity (OAU) Convention Governing the Specific Aspects of Refugee Problems in Africa, the refugee definition contained in the 1984 Cartagena Declaration on Refugees as incorporated into national laws, those recognized in accordance with the UNHCR Statute, individuals granted complementary forms of protection, and those enjoying temporary protection. The refugee population also includes people in a refugee-like situation, which is a category that is descriptive in nature and includes groups of people who are outside their country or territory of origin and who face protection risks similar to those of refugees, but for whom refugee status has, for practical or other reasons, not been ascertained. Refugees under the mandate of the United Nations Relief and Works Agency for Palestine Refugees in the Near East (UNRWA), Palestine Refugees, are not typically included in the statistics on refugees (and people in a refugee-like situation) under the mandate of the UNHCR.",Most recent value within 2018-2022. Years range 2019-2022; most common year 2022; 99.2% of values from 2022.,240,"Refugee Population Statistics Database, UN High Commissioner for Refugees (UNHCR), uri: https://www.unhcr.org/refugee-statistics/download"